{
  "source_id": "src-mn-sos-mbls-2026-08-26",
  "canonical_url": "https://mblsportal.sos.mn.gov/Business/Search",
  "issuing_body": "Minnesota Secretary of State, Minnesota Business & Lien System",
  "title": "MBLS business-filing search and detail pages retrieved 2026-08-26",
  "retrieval_date": "2026-08-26",
  "document_type": "agency_record",
  "local_path": "research/entities/raw/mn-sos-extract.json",
  "access_status": "available",
  "notes": "Public business-entity records. Retrieved via the user's computer after the research host was TLS-blocked from mblsportal.sos.state.mn.us. Officers and registered-office fields are current as of retrieval, not a 2020\u20132022 snapshot. Filing-history rows are dated SOS events.",
  "source_tier": 7,
  "source_status": "PRIMARY_AGENCY_RECORD"
}
