{
  "source_id": "src-doj-criminal-2026-05-20-mahamud-information",
  "title": "Information, United States v. Fahima Egeh Mahamud, No. 0:26-cr-00097-JWB, Doc. 26",
  "canonical_url": "https://www.justice.gov/criminal/media/1441906/dl?inline=",
  "archive_url": null,
  "issuing_body": "United States District Court, District of Minnesota; public copy hosted by U.S. Department of Justice, Criminal Division",
  "document_type": "information",
  "document_date": "2026-05-20",
  "publication_date": null,
  "retrieval_date": "2026-08-30",
  "case_number": "0:26-cr-00097-JWB",
  "court": "United States District Court, District of Minnesota",
  "docket_id": "0:26-cr-00097-JWB",
  "local_path": null,
  "sha256": null,
  "page_count": 12,
  "access_status": "available",
  "source_tier": 1,
  "source_status": "PRIMARY_COURT_RECORD",
  "notes": "Court-filed Information, Doc. 26, filed 2026-05-20. Count 1 charges wire fraud under 18 U.S.C. §§ 1343 and 2 in connection with the Federal Child Nutrition Program / Feeding Our Future conduct; Count 2 charges conspiracy to defraud the United States under 18 U.S.C. § 371 in connection with the separate Child Care Assistance Program conduct. The charging allegations are not adjudicated facts. DOJ's July 2026 Minnesota case-summary page separately summarizes the same filing."
}
