{
  "source_id": "src-mnd-22-cr-00124-ecf57-farah-superseding",
  "canonical_url": "https://www.courtlistener.com/docket/63409881/57/united-states-v-farah/",
  "archive_url": "https://archive.org/download/gov.uscourts.mnd.201530/gov.uscourts.mnd.201530.57.0.pdf",
  "issuing_body": "United States District Court, District of Minnesota",
  "title": "Superseding Indictment, United States v. Abdiaziz Shafii Farah et al., No. 0:22-cr-00124 (D. Minn. ECF 57)",
  "publication_date": "2022-09-13",
  "retrieval_date": "2026-08-26",
  "document_date": "2022-09-13",
  "document_type": "superseding_indictment",
  "case_number": "0:22-cr-00124",
  "court": "United States District Court, District of Minnesota",
  "docket_id": "63409881",
  "local_path": "research/court/pdfs/0_22-cr-00124_ecf57_Superseding-Indictment.pdf",
  "sha256": "b20c786a70f454083482ed82e533f379f0dc1bab9272cee21b5d8854d766609c",
  "mime_type": "application/pdf",
  "page_count": 48,
  "extracted_text_path": "research/court/raw/farah-22-cr-124-ecf57.txt",
  "access_status": "archived",
  "supersedes": null,
  "notes": "Public RECAP/IA copy of ECF 57 (pacer case 201530). TIFF scan (PaperStream fi-7700). Sequential pdftoppm+tesseract at ~180 dpi saved under court/raw/farah-22-cr-124-ecf57.txt. 43-count Feeding Our Future / Empire Cuisine family superseding indictment; not HSS. Caption 18 U.S.C. 371, 666, 1343, 1542, 1956, 1957. Face stamp SCANNED SEP 13 2022; unsealed 2022-09-20 per prior stub/docket harvest, not printed on page 1. Allegations only; not a judgment. 40 million Empire alleged_loss overlaps Bock 250M network headline - do not add. CL also has docket 65361787 (pacer 201529) for this case number; that IA bundle does not contain 57.0.pdf.",
  "source_tier": 1,
  "source_status": "PRIMARY_COURT_RECORD"
}
