{
  "source_id": "src-us-v-adow-anwar-25cr353-ecf1",
  "canonical_url": null,
  "issuing_body": "United States Attorney, District of Minnesota",
  "title": "United States v. Anwar Ahmed Adow, 0:25-cr-00353-PAM, ECF 1 Felony Information",
  "document_date": "2025-09-18",
  "retrieval_date": "2026-08-26",
  "document_type": "information",
  "case_number": "0:25-cr-00353-PAM",
  "court": "United States District Court, District of Minnesota",
  "docket_id": "0:25-cr-00353",
  "local_path": "research/court/pdfs/0_25-cr-00353_ecf1_anwar-adow-hss.pdf",
  "sha256": "c449cde383c96511ad2b0b02c75e57673dc4f72cb9b12d02d9adf87c0f80d81f",
  "mime_type": "application/pdf",
  "page_count": 6,
  "extracted_text_path": "research/court/raw/anwar-adow-25-cr-353-ecf1.txt",
  "access_status": "archived",
  "notes": "Felony information, not an indictment. Text PDF (not a scan). All dollar figures are charging allegations. Paragraph 8 program-wide HSS payouts are background program_spend, not Anwar Adow's alleged receipts. Do not add them to the >$1.2 million Liberty Plus figure or to FOF amounts.",
  "source_tier": 1,
  "source_status": "PRIMARY_COURT_RECORD"
}
